{
  "contract_version": "v1",
  "record_id": "event-bridge-01-20260827-140500",
  "record_type": "event_audit_record",
  "site_id": "site-bridge-01",
  "camera_id": "camera-bridge-01-main",
  "timestamp": "2026-08-27T14:05:00+05:45",
  "event_type": "risk_state_changed",
  "software_version": "0.1.0",
  "config_version": "config-2026-08-27-a",
  "model_version": "model-baseline-001",
  "input_quality_state": "USABLE",
  "risk_state": "HIGH",
  "reason_codes": [
    "HIGH_WATER_COVERAGE",
    "PERSISTENT_WATER_INCREASE",
    "RISK_STATE_CHANGED",
    "ALERT_CANDIDATE_CREATED"
  ],
  "evidence_window": {
    "start": "2026-08-27T13:59:00+05:45",
    "end": "2026-08-27T14:05:00+05:45",
    "duration_seconds": 360
  },
  "component_signals": {
    "water_coverage_ratio": 0.72,
    "temporal_state": "SUSTAINED_RISE"
  },
  "alert_action_taken": "alert_candidate_created",
  "public_fields": {
    "public_location_label": "Example River near Old footbridge"
  }
}
