{
  "contract_version": "v1",
  "record_id": "event-bridge-01-20260827-141000",
  "record_type": "event_audit_record",
  "site_id": "site-bridge-01",
  "camera_id": "camera-bridge-01-main",
  "timestamp": "2026-08-27T14:10:00+05:45",
  "event_type": "camera_feed_degraded",
  "software_version": "0.1.0",
  "config_version": "config-2026-08-27-a",
  "input_quality_state": "UNKNOWN",
  "risk_state": "UNKNOWN_DEGRADED",
  "reason_codes": [
    "CAMERA_OFFLINE",
    "INPUT_UNKNOWN",
    "OFFICIAL_WARNING_NOT_CREATED"
  ],
  "evidence_window": {
    "start": "2026-08-27T14:09:00+05:45",
    "end": "2026-08-27T14:10:00+05:45",
    "duration_seconds": 60
  },
  "local_storage_state": "available"
}
